{
  "schema_version": 1,
  "case_id": "C2",
  "run": "artifact-baseline-1",
  "run_kind": "artifact-baseline",
  "generator_version": "git:2aa53c6efd3d14eaf27f4827e2fbf7f084512796",
  "ds_version": "git:2aa53c6efd3d14eaf27f4827e2fbf7f084512796",
  "project_version": "git:b11c70fb96dc2ff5fd900e9540f82c41ae859499",
  "versions": {
    "generator": {
      "value": "git:2aa53c6efd3d14eaf27f4827e2fbf7f084512796",
      "recorded_in_project": true
    },
    "design_system": {
      "value": "git:2aa53c6efd3d14eaf27f4827e2fbf7f084512796",
      "recorded_in_project": true
    },
    "project": {
      "value": "git:b11c70fb96dc2ff5fd900e9540f82c41ae859499",
      "recorded_in_project": false
    }
  },
  "scorer_version": "1",
  "evaluated_at": "2026-10-22T04:35:38.081Z",
  "evaluated_at_commit": "git:b11c70fb96dc2ff5fd900e9540f82c41ae859499",
  "working_tree_clean": false,
  "status_reproducible": false,
  "status": "pass",
  "measured_metrics": [
    "technical-correctness",
    "adaptivity-and-accessibility",
    "design-system-reuse",
    "portability"
  ],
  "hashes": {
    "project_manifest": "e12d24ac635f646ced703079b351dbe52f255b98b9f1a44f207b1c609fab31e5",
    "qa_results": "712b00840c3d73e8450ff2ab95ea5de6d089f660406545b518e0db7ed44d05ef",
    "token_map": "b4e7098ad494a5d628c7ed6a98e64ef363a5676ab2f41f87e0adcbf4619427bc"
  },
  "objective": {
    "score": 38.73,
    "score_out_of": 50,
    "percentage": 77.46,
    "metrics": [
      {
        "name": "technical-correctness",
        "max": 15,
        "score": 15,
        "checks": [
          {
            "id": "console-errors",
            "status": "passed",
            "factor": 1,
            "known_issue_exempt": false
          },
          {
            "id": "failed-requests",
            "status": "passed",
            "factor": 1,
            "known_issue_exempt": false
          },
          {
            "id": "http-errors",
            "status": "passed",
            "factor": 1,
            "known_issue_exempt": false
          },
          {
            "id": "broken-images",
            "status": "passed",
            "factor": 1,
            "known_issue_exempt": false
          },
          {
            "id": "external-hosts",
            "status": "passed",
            "factor": 1,
            "known_issue_exempt": false
          },
          {
            "id": "undefined-tokens",
            "status": "passed",
            "factor": 1,
            "known_issue_exempt": false
          },
          {
            "id": "undefined-icons",
            "status": "warning",
            "factor": 1,
            "known_issue_exempt": true
          },
          {
            "id": "undefined-ds-classes",
            "status": "passed",
            "factor": 1,
            "known_issue_exempt": false
          }
        ],
        "known_issue_rule": "warning with only non-overdue known debts = passed; other warnings = 0.5"
      },
      {
        "name": "adaptivity-and-accessibility",
        "max": 15,
        "score": 9.5,
        "overflow": 5,
        "static": 4.5,
        "axe": 0,
        "axe_incomplete": 57
      },
      {
        "name": "design-system-reuse",
        "max": 10,
        "score": 4.23,
        "section_mapping": 1.36,
        "ds_class_ratio": 2.86,
        "top_level_sections": 11,
        "ds_class_uses": 154,
        "all_class_uses": 269
      },
      {
        "name": "portability",
        "max": 10,
        "score": 10,
        "site_build": {
          "status": "passed"
        },
        "check_site": {
          "status": "passed",
          "response_count": 288
        },
        "external_resources": {
          "status": "passed"
        }
      }
    ],
    "not_measured": [
      "process-reliability",
      "speed-and-cost"
    ]
  },
  "expert": {
    "status": "not-reviewed",
    "score": null
  },
  "reviewer_flags": {
    "local_extend": null,
    "custom_styles_lost": null
  },
  "evidence": {
    "qa_results": "projects/house-store/artifacts/qa/latest/results.json",
    "compliance": {
      "top_level_sections": 11,
      "mapped_sections": 3,
      "reuse_compose_sections": 3,
      "compliant_reuse_compose_sections": 3,
      "compliance_errors": 0
    },
    "hard_failures": []
  }
}
